ID,Sitio,Índice del lugar,Nombre del lugar,Enlace del lugar,Municipio,Valoración,Valoraciones,Precio,Comentario,Fecha,Votos a favor,Votos en contra,Valoración_num,Sentimiento
427,Tripadvisor,50,Isla Múcura,https://www.tripadvisor.co/Attraction_Review-g4452849-d2536595-Reviews-or20-Isla_Mucura-San_Onofre_Sucre_Department.html, San Onofre,4.5/5,281,Precio Desconocido,"Una isla casi virgen Múcura es una pequeña isla, se puede recorrer caminando de un extremo a otro. Hermosa vegetación, palmeras y zona de manglares, hay un parque nacional dentro de ella, con abundante vida acuática, se puede hacer snorkel en cualquier parte de la isla y observar peces, estrellas de mar y caracoles en cantidades, sin necesidad de contratar ninguna excursión. Es una isla muy poco explotada turísticamente, tiene solamente dos hoteles, uno de más categoría que el otro con servicios de restaurante y piscina, pero cualquier viajero puede alojarse allí o ir a pasar la tarde, ya que hay para todos los bolsillos. Para los más osados, se puede acampar (recordar que no hay agua potable, hay que llevar abundante agua mineral del pueblo Tolu- el más cercano a 45 minutos), o dormir en las cabañas de Wilmer. Las provisiones llegan cada tanto a la isla, por lo que pueden escasear ciertos alimentos, por lo que no es mala idea llevarse algún gustito extra del pueblo como por ejemplo, unos snacks o dulces. La luz eléctrica no funciona todo el día, a la noche se corta la electricidad. La parte turística de la isla es explotada por sus pobladores o por sus vecinos de Santa Cruz del Islote (la isla más densamente poblada del mundo, donde conviven aprox. 1250 personas -todas parientes entre sí-en una sola hectárea). Para mí se trata de un paraíso que hallé de casualidad viendo el Google Earth y que me gustaría se mantenga siempre así con su gente y su naturaleza viva, casi virgen. No esperen comercios, ni merchandising. Múcura no es un lugar apto para pretenciosos, o para quienes busquen el lujo, o hacer shopping, es una tierra para vivir la playa, el mar, y el sol en carne viva en todo su esplendor.",27 de julio de 2015,1,0,4.5,neutral
420,Tripadvisor,50,Isla Múcura,https://www.tripadvisor.co/Attraction_Review-g4452849-d2536595-Reviews-or20-Isla_Mucura-San_Onofre_Sucre_Department.html, San Onofre,4.5/5,281,Precio Desconocido,"Paraíso Una isla súper recomendada, no es muy conocida pero es hermosa, los tonos del mar son fantásticos, y actualmente ofrece variedad hotelera.",29 de octubre de 2015,0,0,4.5,neutral
611,Tripadvisor,52,Ciénaga la Caimanera,https://www.tripadvisor.co/Attraction_Review-g616329-d10022459-Reviews-Cienaga_la_Caimanera-Covenas_Sucre_Department.html,Coveñas,4.5/5,86,Precio Desconocido,"Una aventura de puro aire limpio y naturaleza plena, en verdad, las tarifas son bastante conversables, logra ver una fauna y flora bastante diferente. Lo ideal no es alimentar a los animales, para no contaminar el lugar. Precaución con la gente delicada del estómago con comer ostras, son muy sabrosas pero no a todos les caen bien.",18 de junio de 2018,1,0,4.5,neutral
778,Tripadvisor,58,Orla de Tolu,https://www.tripadvisor.co/Attraction_Review-g1726000-d8838800-Reviews-or20-Orla_de_Tolu-Santiago_de_Tolu_Sucre_Department.html,Santiago de Tolú,4.0/5,31,Precio Desconocido,"Tolú no es un pueblo que fascine y sus playas quizás no sean las mejores, pero encontrar en un solo lugar el ambiente de pueblo, con carretas tiradas por burros, una caleta de pescadores con mucho pero mucho pescado y marisco y una coqueta playa es poco usual. Como llegamos en temporada muy baja las pequeñas playas, delimitadas por rompeolas, eran exclusivas para nosotros, casi igual la piscina del hotel. Supongo en temporada alta debe ser incomodo, pero en el pueblo casi vacío fue una estadía muy placentera.",14 de febrero de 2020,0,0,4,neutral
819,Tripadvisor,59,Catedral de San Francisco,https://www.tripadvisor.co/Attraction_Review-g1395140-d6960179-Reviews-or20-Catedral_de_San_Francisco-Sincelejo_Sucre_Department.html,Sincelejo,4.0/5,30,Precio Desconocido,"Es un lindo lugar para oración y encuentro personal con Dios. Es catedral y tienen obispo a bordo, es un digno ejemplo de iglesia de ciudad pequeña.",4 de febrero de 2016,0,0,4,neutral
787,Tripadvisor,58,Orla de Tolu,https://www.tripadvisor.co/Attraction_Review-g1726000-d8838800-Reviews-or20-Orla_de_Tolu-Santiago_de_Tolu_Sucre_Department.html,Santiago de Tolú,4.0/5,31,Precio Desconocido,"Bueno la playa de Tolu, su malecon, en el dia se veia algo solo el lugar, en la noche no se de donde salio tanta gente y tanto turista, me parecio un luar seguro y bueno para conocer y disfrutar. Muchas gracias.",29 de diciembre de 2016,0,0,4,neutral
212,Foursquare,35,Gran Centro El Parque,https://foursquare.com/v/gran-centro-el-parque/4c5b498c7735c9b697548972,Sincelejo,7.3/10,11 valoraciones,Precio Desconocido,Saben si en el gran centro el parque venden cartas de yu gi oh?,"Junio 26, 2015",0,0,7.3,positivo
697,Tripadvisor,54,Parque Comercial Guacarí,https://www.tripadvisor.co/Attraction_Review-g1395140-d13995376-Reviews-or10-Parque_Comercial_Guacari-Sincelejo_Sucre_Department.html,Sincelejo,4.5/5,15,Precio Desconocido,"Bonito Es el más moderno que tiene la ciudad de Sincelejo, no es muy grande, pero tiene muchas tiendas variadas, así mismo zona de comidas, y supermercado. Lo bueno tiene aire acondicionado que es dispensable en ese clima tan caliente. Lo malo es un poco difícil encontrar parqueadero.",29 de enero de 2020,0,0,4.5,neutral
636,Tripadvisor,52,Ciénaga la Caimanera,https://www.tripadvisor.co/Attraction_Review-g616329-d10022459-Reviews-Cienaga_la_Caimanera-Covenas_Sucre_Department.html,Coveñas,4.5/5,86,Precio Desconocido,"Es una visita que no se la pueden perder, desde Tolú agarran los colectivos azules en dirección Coveñas, que los dejan en la entrada de la Ciénaga de la Caimanera, los lugareños tienen canoas que los llevan por toda la ciénaga, tienen tarifas fijas y publicadas en un cartel, desde 15 mil a 60 mil la pareja, NO van a encontrar caimanes sueltos, simplemente en un encuentro con los Manglares, muchos cangrejos y aves, en el centro hay una casa flotante donde pueden probar almejas recién sacadas en un buen baño de limón (no apto para escrupulosos) y si quieren concha de nácar allí les ofrecen, los dejan al final del tour en la reserva ecológica, donde por una colaboración de 10 mil pesos pueden ver los caimanes, cocodrilos, tortugas y loritos que están siendo rehabilitadas y posteriormente dejadas en libertad.",23 de octubre de 2016,0,0,4.5,neutral
193,Foursquare,29,Éxito Sincelejo Centro,https://es.foursquare.com/v/%C3%A9xito-sincelejo-centro/4c20be62ebe52d7f19083178,Sincelejo,7.4/10,13 valoraciones,Precio Desconocido,Encontréajípicantede Perú(rocoto),"Febrero 23, 2015",0,0,7.4,positivo
1266,Tripadvisor,79,Anfibio Sports Adventure,https://www.tripadvisor.co/Attraction_Review-g10326747-d23061629-Reviews-or30-Anfibio_Sports_Adventure-Rincon_del_Mar_San_Onofre_Sucre_Department.html,San Onofre,5.0/5,34,Precio Desconocido,"Excelente! Pasamos un día muy lindo con Ciro descubriendo la zona y conociendo un lado muy diferente del lugar!! Quedamos encantados con el paseo en bici, y el trato un diez!! Queda pendiente el paddle para la siguiente!!",20 de febrero de 2021,1,0,5,neutral
456,Tripadvisor,50,Isla Múcura,https://www.tripadvisor.co/Attraction_Review-g4452849-d2536595-Reviews-or20-Isla_Mucura-San_Onofre_Sucre_Department.html, San Onofre,4.5/5,281,Precio Desconocido,"Espectacular Isla Me encantó, muy tranquilo y hermoso, la comida buena, es un sueño maravilloso, recomendable conocerlo!",13 de enero de 2015,0,0,4.5,neutral
1011,Tripadvisor,74,Covenas Diving Co.,https://www.tripadvisor.co/Attraction_Review-g616329-d13199404-Reviews-or220-Covenas_Diving_Co-Covenas_Sucre_Department.html,Coveñas,5.0/5,259,Precio Desconocido,"Fue mi primera experiencia de buceo, creo que elegir un momento favorito es una tarea casi imposible para mí, todo fue espectacular superó mis expectativas. Siendo primera vez al principio estaba nerviosa pero a medida que le fui cogiendo el gusto al asunto, que aprendí a respirar primero de manera consciente por la boca y luego de una manera más automática me relajé y disfruté al máximo la experiencia, que pronto repetiré. Mis recomendaciones para quienes se atrevan a ser partícipes de esta magnífica experiencia es que el buzo que les dan en el local se lo lleven hasta al punto de inmersión, porque es para usarlo, no hagan como yo, que lo dejé en el local pensando que era un recordatorio y me broncee obligatoriamente porque además de eso se pueden maltratar el torso con el equipo de buceo. Lo otro es que agenden días posteriores de descanso porque es una actividad física exigente, se ejercita todo el cuerpo y las piernas que nos dan movilidad de una manera diferente bajo el agua, al salir necesitan unos estiramientos para relajarse.",24 de septiembre de 2020,0,0,5,neutral
55,Foursquare,2,Playas de Coveñas,https://es.foursquare.com/v/playas-de-cove%C3%B1as/4e0b5bd352b1fe83d54c6f4b,Coveñas,8.8/10,241 valoraciones,Precio Desconocido,Asegurarse de traer efectivo. No se encuentra ningúncajeroen la zona y los lugares no tienen datáfono.,"Diciembre 29, 2013",0,0,8.8,positivo
209,Foursquare,34,Celupizza,https://foursquare.com/v/celupizza/4ca0171546978cfa0cfdb07f,Sincelejo,7.3/10,11 valoraciones,$,No se valla de Sincelejo sin probar y tratar de comerse un Desgranado Combinado #Recomendado,"Enero 26, 2012",1,0,7.3,positivo
614,Tripadvisor,52,Ciénaga la Caimanera,https://www.tripadvisor.co/Attraction_Review-g616329-d10022459-Reviews-Cienaga_la_Caimanera-Covenas_Sucre_Department.html,Coveñas,4.5/5,86,Precio Desconocido,"Llegar al puente de la caimanera, comentar y hacer el arreglo de la tarifa con un avezado barquero, quien te lleva sobre las aguas tranquilas de este gran espejo de agua en una canoa de madera y que por un kilómetro se introduce por entre verdes manglares, en cuyas raíces habitan las ostras y durante el trayecto el barquero recoge para luego en la casa flotante, construida de madera, te las abren para degustar lo que los nativos llaman el viagra Costeño, y si que lo es. Complementa el viaje una sumergida en estas aguas que son salobres (dulce y salada) se hace cerca a la casa, finalmente el barquero te llevará por el túnel del amor, un laberinto construido por entre la espesa y cerrada raíces del mangle, donde se ven cangrejos, y varias especies de cigüeñas; es un paseo relajante y muy recomendado para quienes gusten de entrar en contacto con el agua y el silencio.",14 de enero de 2018,2,0,4.5,neutral
1151,Tripadvisor,75,Rincón Dive Center,https://www.tripadvisor.co/Attraction_Review-g10326747-d14126059-Reviews-or60-Rincon_Dive_Center-Rincon_del_Mar_San_Onofre_Sucre_Department.html,San Onofre,5.0/5,192,Precio Desconocido,"Giovanni y Stefi están instructores apasionados y es un placer de bucear con ellos. Unos de mis mejores buceos, Los sitios están muy lindos y preservados. No se puede faltar esta experiencia.",28 de septiembre de 2021,1,0,5,neutral
21,Foursquare,1,Rincón del Mar,https://es.foursquare.com/v/rinc%C3%B3n-del-mar/4f81a185e4b0ac16a2d8f323,San Onofre,8.9/10,45 valoraciones,Precio Desconocido,"Almuerzoen elrestaurante""LaNegrita""","Marzo 5, 2015",0,0,8.9,positivo
760,Tripadvisor,57,Archipiélago De San Bernardo,https://www.tripadvisor.co/Attraction_Review-g616329-d14930714-Reviews-or20-Archipelago_Of_San_Bernardo-Covenas_Sucre_Department.html,Coveñas,4.0/5,29,Precio Desconocido,"Es un lugar maravilloso. Fuimos en un barco tipo yate que no se mueve tanto, vale la pena el valor adicional para lo que no pueden ir en lanchas más movidas. Se pasa por varias islas del golfo de Morrosquillo con playas muy lindas. Se desciende en la isla más poblada y luego gran parte del paseo nos quedamos en la isla Tintipan, muy recomendada con playas de arena muy fina y oleaje muy tranquilo, muy bueno el almuerzo incluido.",25 de agosto de 2019,4,0,4,neutral
450,Tripadvisor,50,Isla Múcura,https://www.tripadvisor.co/Attraction_Review-g4452849-d2536595-Reviews-or20-Isla_Mucura-San_Onofre_Sucre_Department.html, San Onofre,4.5/5,281,Precio Desconocido,"Una hermosa isla no tan frecuentada Se puede llegar a la Isla muy fácilmente desde Tolú. Hay pocas opciones de alojamiento para todos los bolsillos, por lo que no es un destino caro necesariamente. Importante llevar algunas provisiones, aunque hay un par de tiendas.",7 de febrero de 2015,0,0,4.5,neutral
101,Foursquare,7,Palma Caoba,https://es.foursquare.com/v/palma-caoba/4e626a9052b1260c131e2e05,Coveñas,8.2/10,12 valoraciones,Precio Desconocido,Excelente lugar para pasar una semana lejos de las preocupaciones. Lascabañasestán a un paso de las mejoresplayas;equipadascon todas lascomodidadesy elpersonaldel lugar siempre es amable.,"Noviembre 30, 2014",0,0,8.2,positivo
1258,Tripadvisor,79,Anfibio Sports Adventure,https://www.tripadvisor.co/Attraction_Review-g10326747-d23061629-Reviews-or30-Anfibio_Sports_Adventure-Rincon_del_Mar_San_Onofre_Sucre_Department.html,San Onofre,5.0/5,34,Precio Desconocido,"Paddle board, casi 3 horas de buena práctica con minicurso y excelente explicación por parte de Ciro el chico de anfibios sports",1 de abril de 2021,0,0,5,neutral
275,Foursquare,45,Centro Comercial VIVA,https://foursquare.com/v/centro-comercial-viva/4c367fa418e72d7f0f0515f5,Sincelejo,6.8/10,155 valoraciones,Precio Desconocido,Ha cambiado para bien. La zona de comidas muy pequeña. Buena variedad de almacenes y marcas. La entrada a las salas de cine Muy reducida,"Enero 10, 2017",0,0,6.8,neutral
2,Foursquare,1,Rincón del Mar,https://es.foursquare.com/v/rinc%C3%B3n-del-mar/4f81a185e4b0ac16a2d8f323,San Onofre,8.9/10,45 valoraciones,Precio Desconocido,Este lugar es genial!! Lasplayasson muy hermosas ytranquilas. Lagentees muy amable. Perfecto para tomar unacervezapor laplayay comerostras frescas.,"Enero 9, 2018",0,0,8.9,positivo
374,Tripadvisor,50,Isla Múcura,https://www.tripadvisor.co/Attraction_Review-g4452849-d2536595-Reviews-or20-Isla_Mucura-San_Onofre_Sucre_Department.html, San Onofre,4.5/5,281,Precio Desconocido,"De las playas que conozco, esta ha sido la mas hermosa que he conocido, es un lugar muy acogedor en donde se pueden experimentar las mejores vistas del mundo. Les recomiendo mucho ir al tour del Plancton, donde puedes ver as luces en el agua, es una experiencia inolvidable.",23 de octubre de 2017,0,0,4.5,neutral
1236,Tripadvisor,78,Mar de leva tour,https://www.tripadvisor.co/Attraction_Review-g10326747-d25178400-Reviews-Mar_de_leva_tour-Rincon_del_Mar_San_Onofre_Sucre_Department.html,San Onofre,5.0/5,12,Precio Desconocido,"Excelente servicio y atención, Guillermo es muy amable, conduce muy bien y conoce la zona y lugares turísticos, el transporte es confortable, rincón del mar un destino para descansar y relajarse, el tour de las islas de San Bernardo y el plancton luminoso una experiencia inolvidable.",19 de enero de 2024,0,0,5,neutral
745,Tripadvisor,56,Playa la Coquerita,https://www.tripadvisor.co/Attraction_Review-g616329-d10465002-Reviews-or20-Playa_la_Coquerita-Covenas_Sucre_Department.html,Coveñas,4.0/5,28,Precio Desconocido,"Es una de las playas más bonitas del Golfo de Morrosquillo, especialmente adecuada para la tranquilidad de las familias que van con niños pequeños. El ambiente es muy tranquilo y los lugareños son muy amables.",21 de junio de 2016,0,0,4,neutral
3,Foursquare,1,Rincón del Mar,https://es.foursquare.com/v/rinc%C3%B3n-del-mar/4f81a185e4b0ac16a2d8f323,San Onofre,8.9/10,45 valoraciones,Precio Desconocido,"Súperlindaslasplayas! Si estas ahí no puedes dejar de ir a la isla Múcura: variedad decoloresen elmar,agua cristalinay peces nadando cerca de la orilla.","Febrero 18, 2013",0,0,8.9,positivo
1044,Tripadvisor,74,Covenas Diving Co.,https://www.tripadvisor.co/Attraction_Review-g616329-d13199404-Reviews-or220-Covenas_Diving_Co-Covenas_Sucre_Department.html,Coveñas,5.0/5,259,Precio Desconocido,"Conocí al instructor Guillermo en Santa Marta y me pareció tan buen instructor y ahora amigo, que dije, voy a hacer toda la carrera de buceo con él. Un gran profesional, un gran instructor y amigo. Además, cuenta con su propia logística por tierra y un bote para los sitios de buceo.",18 de diciembre de 2019,2,0,5,neutral
408,Tripadvisor,50,Isla Múcura,https://www.tripadvisor.co/Attraction_Review-g4452849-d2536595-Reviews-or20-Isla_Mucura-San_Onofre_Sucre_Department.html, San Onofre,4.5/5,281,Precio Desconocido,"Desconectado del mundo Desde que tomas el transporte en lancha en Tolu para llegar a la isla es un desconecte total, las aguas son perfectas para bucear ya que son cristalinas, se puede pescar mucho, es un paraíso.",11 de mayo de 2016,0,0,4.5,neutral
220,Foursquare,37,Happy City Éxito,https://foursquare.com/v/happy-city-%C3%A9xito/50c9fdeb8aca44b2843517a2,Sincelejo,7.3/10,12 valoraciones,Precio Desconocido,Sería bueno que actualizaciones las fotos :),"Noviembre 14, 2015",0,0,7.3,positivo
203,Foursquare,31,Pombo Parrilla,https://foursquare.com/v/pombo-parrilla/4ea6f6e02c5b614a690d9c5d,Sincelejo,7.4/10,15 valoraciones,$$$$,Salsa de ajo,"Enero 3, 2018",0,0,7.4,positivo
790,Tripadvisor,58,Orla de Tolu,https://www.tripadvisor.co/Attraction_Review-g1726000-d8838800-Reviews-or20-Orla_de_Tolu-Santiago_de_Tolu_Sucre_Department.html,Santiago de Tolú,4.0/5,31,Precio Desconocido,"Es un pueblo apacible, en mi concepto nada que conocer, lugar para disfrutar del mar y sus playas. Pienso que debe mejorar",26 de agosto de 2016,0,0,4,neutral
476,Tripadvisor,50,Isla Múcura,https://www.tripadvisor.co/Attraction_Review-g4452849-d2536595-Reviews-or20-Isla_Mucura-San_Onofre_Sucre_Department.html, San Onofre,4.5/5,281,Precio Desconocido,"Paisajes y playa espectacular, alternativas de hotel regular Nos alojamos en el único hotel que hay en esta isla y si bien el entorno es precioso, la alimentación del hotel es pésima. Es para estar no más de dos días si eres una persona que le gusta estar en actividad permanente, porque no hay mucho que hacer.",28 de septiembre de 2014,0,0,4.5,neutral
1198,Tripadvisor,77,Guía de Turismo del Golfo de Morrosquillo,https://www.tripadvisor.co/Attraction_Review-g616329-d12951539-Reviews-or30-Covenas_Colombia_Travel-Covenas_Sucre_Department.html,Coveñas,5.0/5,30,Precio Desconocido,"Lorica es realmente hermosa y llena de historia. Manuel el guía maravilloso, nos explicó todo, nos hizo vivir una excelente experiencia. El restaurante Beirut nos encantó, la comida deliciosa. Súper recomendado Lorica.",16 de enero de 2024,1,0,5,neutral
638,Tripadvisor,52,Ciénaga la Caimanera,https://www.tripadvisor.co/Attraction_Review-g616329-d10022459-Reviews-Cienaga_la_Caimanera-Covenas_Sucre_Department.html,Coveñas,4.5/5,86,Precio Desconocido,"Lugar muy hermoso, un paraíso natural. No es un paseo para todo el día, con dos horas tienes lo suficiente para apreciar lo que ofrece. No olvides protegerte del sol y echarte repelente de mosquitos. Me parece que hace falta más infraestructura, lo que hay es muy artesanal.",20 de septiembre de 2016,0,0,4.5,neutral
334,Tripadvisor,50,Isla Múcura,https://www.tripadvisor.co/Attraction_Review-g4452849-d2536595-Reviews-or20-Isla_Mucura-San_Onofre_Sucre_Department.html, San Onofre,4.5/5,281,Precio Desconocido,"Creo que es un ""must"" para los amantes de la tranquilidad, desconexión de la intensidad de vida en aglorameraciones urbanas y aquellos con ganas de reencontrarse con las cosas simples de la vida.",9 de octubre de 2019,0,0,4.5,neutral
227,Foursquare,38,Plaza de Majagual,https://foursquare.com/v/plaza-de-majagual/4c0193ebf99620a1dbcd2404,Sincelejo,7.2/10,40 valoraciones,Precio Desconocido,un lugar para conocer en Sincelejo,"Marzo 11, 2017",0,0,7.2,positivo
666,Tripadvisor,53,Playas Rincon del Mar,https://www.tripadvisor.co/Attraction_Review-g4452849-d10213520-Reviews-or40-Playas_Rincon_del_Mar-San_Onofre_Sucre_Department.html,San Onofre,4.0/5,51,Precio Desconocido,La comida de mar es fabulosa porque se trata de pescados y mariscos recién capturados y preparados con un sabor sin igual.,9 de marzo de 2020,0,0,4,neutral
1240,Tripadvisor,78,Mar de leva tour,https://www.tripadvisor.co/Attraction_Review-g10326747-d25178400-Reviews-Mar_de_leva_tour-Rincon_del_Mar_San_Onofre_Sucre_Department.html,San Onofre,5.0/5,12,Precio Desconocido,"Viajamos con esta empresa en taxi desde el aeropuerto de cartagena a rincón del mar y desde rincón del mar a cartagena. Lo mas importante, es que la empresa es confiable, nos estaban esperando y salimos a la hora desde rincón del mar ( muy importante para no perder el vuelo). Si están pensando en ir a.rincon de mar: los recomiendo, el servicio es bueno!",9 de abril de 2023,1,0,5,neutral
372,Tripadvisor,50,Isla Múcura,https://www.tripadvisor.co/Attraction_Review-g4452849-d2536595-Reviews-or20-Isla_Mucura-San_Onofre_Sucre_Department.html, San Onofre,4.5/5,281,Precio Desconocido,Un lugar muy bonito y cerca a otros lugares como santa cruz del islote y Tintipan que son de locos. la comida es muy rica en los restaurantes de los lugareños a 20 mil COP (5 dolares),5 de diciembre de 2017,0,0,4.5,neutral
467,Tripadvisor,50,Isla Múcura,https://www.tripadvisor.co/Attraction_Review-g4452849-d2536595-Reviews-or20-Isla_Mucura-San_Onofre_Sucre_Department.html, San Onofre,4.5/5,281,Precio Desconocido,"Isla de ensueño En el Archipiélago de las Corales de las Islas del Rosario y San Bernardo, la isla Múcura se destaca por su belleza natural y una de las playas más fantásticas con arena fina y blanca y aguas cristalinas de múltiples matices. Isla Faro es un hotel muy hermoso que complementa la belleza de la isla. La atención es buena y la cocina con platos típicos caribeños es muy buena. El sitio se presta para el descanso y la relajación total, pero hay opciones para visitar otras islas, bucear, practicar la pesca y divertirse en la playa. Para quienes les encanta el mar, este sitio merece una o varias visitas de fin de semana.",1 de noviembre de 2014,0,0,4.5,neutral
32,Foursquare,2,Playas de Coveñas,https://es.foursquare.com/v/playas-de-cove%C3%B1as/4e0b5bd352b1fe83d54c6f4b,Coveñas,8.8/10,241 valoraciones,Precio Desconocido,"Excelente lo mejor esbañarseen la mañana porque en la tarde hay oleaje, deliciosa la comida! Recomendado","Diciembre 29, 2013",5,0,8.8,positivo
1152,Tripadvisor,75,Rincón Dive Center,https://www.tripadvisor.co/Attraction_Review-g10326747-d14126059-Reviews-or60-Rincon_Dive_Center-Rincon_del_Mar_San_Onofre_Sucre_Department.html,San Onofre,5.0/5,192,Precio Desconocido,"Una experiencia inolvidable, descubrimos el hermoso mundo del buceo a través de la guía Stefi y Gio, quienes con su profesionalismo, experiencia nos permitieron disfrutar y aprender este maravilloso mundo bajo el mar en las hermosas aguas de Rincón del mar.",24 de agosto de 2021,1,0,5,neutral
878,Tripadvisor,64,Plaza de Majagual,https://www.tripadvisor.co/Attraction_Review-g1395140-d6951865-Reviews-or30-Plaza_de_Majagual-Sincelejo_Sucre_Department.html,Sincelejo,3.5/5,32,Precio Desconocido,"Es un parque que se presta para conciertos al aire libre, en sus alrededores hay varios restaurantes, muy linda la gente.",5 de febrero de 2015,1,0,3.5,negativo
965,Tripadvisor,74,Covenas Diving Co.,https://www.tripadvisor.co/Attraction_Review-g616329-d13199404-Reviews-or220-Covenas_Diving_Co-Covenas_Sucre_Department.html,Coveñas,5.0/5,259,Precio Desconocido,"Increible! Super seguro y una experiencia increible! La certificaciòn d open super recomendada, se toma el tiempo y tiene toda la paciencia y actitud del mundo!",21 de agosto de 2022,0,0,5,neutral
270,Foursquare,43,Nonnina Pizza,https://foursquare.com/v/nonnina-pizza/4d17ec0de190721eee841e21,Sincelejo,6.8/10,12 valoraciones,$,Una de las mejores pizzas de Sincelejo!,"Enero 21, 2011",1,0,6.8,neutral
186,Foursquare,26,Parrilla Bar,https://es.foursquare.com/v/parrilla-bar/4f47c59ee4b08f45dc069cbd,Sincelejo,7.6/10,15 valoraciones,$$$$,Espectacular elsolomilloa lasfinas hierbas.,"Marzo 1, 2013",0,0,7.6,positivo
20,Foursquare,1,Rincón del Mar,https://es.foursquare.com/v/rinc%C3%B3n-del-mar/4f81a185e4b0ac16a2d8f323,San Onofre,8.9/10,45 valoraciones,Precio Desconocido,"Pocagente,playaslimpias y muchatranquilidad","Enero 8, 2014",0,0,8.9,positivo
706,Tripadvisor,54,Parque Comercial Guacarí,https://www.tripadvisor.co/Attraction_Review-g1395140-d13995376-Reviews-or10-Parque_Comercial_Guacari-Sincelejo_Sucre_Department.html,Sincelejo,4.5/5,15,Precio Desconocido,"Es el nuevo centro comercial de la Ciudad de Sincelejo, con buena variedad de tiendas, muy espacioso y linda decoración; aún tiene algunos espacios vacíos pero con seguridad en poco tiempo ya no habrá ninguno. El cine es muy cómodo, amplia sala de juegos y las opciones de comidas top. Muy bueno para salir en familia a pasar un día diferente y aprovechar de comprar con comodidad.",18 de julio de 2018,0,0,4.5,neutral
1298,Tripadvisor,81,Sunset Travel Colombia,https://www.tripadvisor.co/Attraction_Review-g1395140-d21293956-Reviews-Sunset_Travel_Colombia-Sincelejo_Sucre_Department.html,Sincelejo,5.0/5,5,Precio Desconocido,"Todo fue espectacular, la atención súper, he repetido varias veces la experiencia, la comida, los paisajes todo recomendado!!!",19 de septiembre de 2020,0,0,5,neutral
