ID,Sitio,Índice del lugar,Nombre del lugar,Enlace del lugar,Municipio,Valoración,Valoraciones,Precio,Comentario,Fecha,Votos a favor,Votos en contra,Valoración_num,Sentimiento
265,Foursquare,43,Nonnina Pizza,https://foursquare.com/v/nonnina-pizza/4d17ec0de190721eee841e21,Sincelejo,6.8/10,12 valoraciones,$,Espectaculares las pizzas,"Agosto 11, 2014",0,0,6.8,neutral
650,Tripadvisor,52,Ciénaga la Caimanera,https://www.tripadvisor.co/Attraction_Review-g616329-d10022459-Reviews-Cienaga_la_Caimanera-Covenas_Sucre_Department.html,Coveñas,4.5/5,86,Precio Desconocido,"En lancha puedes recorrer varios parajes como las caimaneras donde los crian y evitan su extinción, las cienagas donde puedes buscar ostras si quieres, la casa flotante al medio del mar donde te puedes bajar y caminar y el agua te llega a la mitad de la cintura y te sientes grande! Recomendadisimo.",31 de marzo de 2016,0,0,4.5,neutral
805,Tripadvisor,59,Catedral de San Francisco,https://www.tripadvisor.co/Attraction_Review-g1395140-d6960179-Reviews-or20-Catedral_de_San_Francisco-Sincelejo_Sucre_Department.html,Sincelejo,4.0/5,30,Precio Desconocido,Estaba cerrada por remodelación en el interior pero ya está abierta a los feligreses y quedó muy buena.,9 de mayo de 2018,0,0,4,neutral
1061,Tripadvisor,74,Covenas Diving Co.,https://www.tripadvisor.co/Attraction_Review-g616329-d13199404-Reviews-or220-Covenas_Diving_Co-Covenas_Sucre_Department.html,Coveñas,5.0/5,259,Precio Desconocido,Una experiencia maravillosa y acompañados del mejor equipo. Personas muy profesionales y responsables. Totalmente recomendados.,24 de octubre de 2019,0,0,5,neutral
986,Tripadvisor,74,Covenas Diving Co.,https://www.tripadvisor.co/Attraction_Review-g616329-d13199404-Reviews-or220-Covenas_Diving_Co-Covenas_Sucre_Department.html,Coveñas,5.0/5,259,Precio Desconocido,"Fue mi segunda experiencia de buceo y espectacular! El arrecife coralino está muy conservado; además el servicio por parte de los Instructores Guillo y Sebastian el mejor, lo recomiendo sin duda ✍🏼🤿🐟💯.",15 de enero de 2021,0,0,5,neutral
539,Tripadvisor,50,Isla Múcura,https://www.tripadvisor.co/Attraction_Review-g4452849-d2536595-Reviews-or20-Isla_Mucura-San_Onofre_Sucre_Department.html, San Onofre,4.5/5,281,Precio Desconocido,INCREÍBLE Esta isla no tiene comparación si quieres tener una muy buena y relajantes vacaciones. Sin duda lo recomiendo para pasar la noche.,27 de enero de 2015,0,0,4.5,neutral
671,Tripadvisor,53,Playas Rincon del Mar,https://www.tripadvisor.co/Attraction_Review-g4452849-d10213520-Reviews-or40-Playas_Rincon_del_Mar-San_Onofre_Sucre_Department.html,San Onofre,4.0/5,51,Precio Desconocido,"Las playas del Rincón son maravillosas. Cercano a las islas de San Bernardo, un sitio perfecto para el buceo.",11 de agosto de 2019,2,0,4,neutral
590,Tripadvisor,52,Ciénaga la Caimanera,https://www.tripadvisor.co/Attraction_Review-g616329-d10022459-Reviews-Cienaga_la_Caimanera-Covenas_Sucre_Department.html,Coveñas,4.5/5,86,Precio Desconocido,Este impresionante lugar combina la belleza del mar con la riqueza biológica de la ciénaga. Los paseos en bote invitan al silencio para respetar la vida alrededor. Las imágenes que se pueden lograr con sus lentes son impactantes.,8 de agosto de 2019,1,0,4.5,neutral
8,Foursquare,1,Rincón del Mar,https://es.foursquare.com/v/rinc%C3%B3n-del-mar/4f81a185e4b0ac16a2d8f323,San Onofre,8.9/10,45 valoraciones,Precio Desconocido,"Playastranquilasy limpias, para almorzar:restaurantelanegrita, y de paso un buencóctel de camarón.","Enero 2, 2013",0,0,8.9,positivo
437,Tripadvisor,50,Isla Múcura,https://www.tripadvisor.co/Attraction_Review-g4452849-d2536595-Reviews-or20-Isla_Mucura-San_Onofre_Sucre_Department.html, San Onofre,4.5/5,281,Precio Desconocido,"Verdaderamente, al fin del afán Un lugar de aquellos que encantan los sentidos...calor, brisa, aguas cálidas, peces de colores, parajes hermosos, gente cordial y alegre. Un servicio excelente. Nuestro recuerdo de: don Sergio, Carlos y Jason, entre muchos que nos brindaron su cálida atención. Sólo agradecimientos. Felices con el aire acondicionado, ya que no estamos acostumbrados a un calor húmedo, como ninguno. Habitaciones cómodas, muy limpias, agua fresca para beber. Las comidas muy ricas, mucho pescado y mariscos, delicioso arroz con coco, limonadas, jugos. La bienvenida y despedida de don Sergio y ese hermoso y gigantesco Higuerón. Un verdadero placer",21 de mayo de 2015,0,0,4.5,neutral
1111,Tripadvisor,74,Covenas Diving Co.,https://www.tripadvisor.co/Attraction_Review-g616329-d13199404-Reviews-or220-Covenas_Diving_Co-Covenas_Sucre_Department.html,Coveñas,5.0/5,259,Precio Desconocido,"El buceo en las islas San Bernardo es muy bueno, condiciones excelentes y muchos colores, además el tour es chevere (buceo y almuerzo en una playa)! Guillermo muy formal y profesional en cuanto a la seguridad y las informaciones sobre el buceo y Ana muy atenta con nosotros en cuanto a la organización! Los recomendamos 100%!",10 de agosto de 2018,1,0,5,neutral
1245,Tripadvisor,79,Anfibio Sports Adventure,https://www.tripadvisor.co/Attraction_Review-g10326747-d23061629-Reviews-or30-Anfibio_Sports_Adventure-Rincon_del_Mar_San_Onofre_Sucre_Department.html,San Onofre,5.0/5,34,Precio Desconocido,Excelente actividad. Ciro es profesional y paciente para first time paddle. Linda manera de conocer más de Rincón Del Mar.,16 de enero de 2022,0,0,5,neutral
169,Foursquare,23,Arcanos,https://es.foursquare.com/v/arcanos/4dbb6aa24b222080d3784b71,Sincelejo,7.7/10,27 valoraciones,$$,"Deliciosa lalasagnade este sitio, la recomiendo.","Octubre 10, 2014",0,0,7.7,positivo
18,Foursquare,1,Rincón del Mar,https://es.foursquare.com/v/rinc%C3%B3n-del-mar/4f81a185e4b0ac16a2d8f323,San Onofre,8.9/10,45 valoraciones,Precio Desconocido,Lachalupalo mejor.,"Julio 23, 2013",0,0,8.9,positivo
862,Tripadvisor,64,Plaza de Majagual,https://www.tripadvisor.co/Attraction_Review-g1395140-d6951865-Reviews-or30-Plaza_de_Majagual-Sincelejo_Sucre_Department.html,Sincelejo,3.5/5,32,Precio Desconocido,"Es una plaza amplia, se realizan las actividades importantes de la ciudad. Cerca hay puestos de jugos naturales que preparan al momento de pedirlos. También está rodeada de sitios para tomar algo y compartir con amigos.",21 de abril de 2017,0,0,3.5,negativo
1052,Tripadvisor,74,Covenas Diving Co.,https://www.tripadvisor.co/Attraction_Review-g616329-d13199404-Reviews-or220-Covenas_Diving_Co-Covenas_Sucre_Department.html,Coveñas,5.0/5,259,Precio Desconocido,Tuve mi primera experiencia de buceo con ellos y fue excelente. Muy atentos y con buenos puntos para distintos niveles de experiencia.,18 de noviembre de 2019,1,0,5,neutral
860,Tripadvisor,64,Plaza de Majagual,https://www.tripadvisor.co/Attraction_Review-g1395140-d6951865-Reviews-or30-Plaza_de_Majagual-Sincelejo_Sucre_Department.html,Sincelejo,3.5/5,32,Precio Desconocido,"Es una plaza muy amplia, excelente para cualquier clase de evento de gran multitud, tiene varias diversiones para niños, y gran variedad de comidas.",6 de noviembre de 2017,0,0,3.5,negativo
102,Foursquare,7,Palma Caoba,https://es.foursquare.com/v/palma-caoba/4e626a9052b1260c131e2e05,Coveñas,8.2/10,12 valoraciones,Precio Desconocido,"Excelente, sin lugar a dudas lo mejorcito delgolfode Morrosquillo... Buenos momentos!!!","Mayo 2, 2016",0,0,8.2,positivo
157,Foursquare,21,Javier Parrilla,https://es.foursquare.com/v/javier-parrilla/4e6f9a2b62e1d475e2443703,Sincelejo,7.7/10,25 valoraciones,$$,Es fea lalenguacriolla. Wakala,"Diciembre 9, 2012",0,0,7.7,positivo
931,Tripadvisor,74,Covenas Diving Co.,https://www.tripadvisor.co/Attraction_Review-g616329-d13199404-Reviews-or220-Covenas_Diving_Co-Covenas_Sucre_Department.html,Coveñas,5.0/5,259,Precio Desconocido,"La experiencia fue increíble, es una actividad para salir de la rutina. Los guías Luly y Jorge fueron muy amables y profesionales. Sin duda alguna, de las mejores actividades que se pueden hacer en Coveñas.",11 de diciembre de 2023,6,0,5,neutral
40,Foursquare,2,Playas de Coveñas,https://es.foursquare.com/v/playas-de-cove%C3%B1as/4e0b5bd352b1fe83d54c6f4b,Coveñas,8.8/10,241 valoraciones,Precio Desconocido,Espectaculares ensenadas para tomar un buenbaño.,"Agosto 11, 2017",0,0,8.8,positivo
229,Foursquare,38,Plaza de Majagual,https://foursquare.com/v/plaza-de-majagual/4c0193ebf99620a1dbcd2404,Sincelejo,7.2/10,40 valoraciones,Precio Desconocido,Nada mejor que las bancas de la plaza de majagual para llorar,"Marzo 20, 2013",2,0,7.2,positivo
858,Tripadvisor,64,Plaza de Majagual,https://www.tripadvisor.co/Attraction_Review-g1395140-d6951865-Reviews-or30-Plaza_de_Majagual-Sincelejo_Sucre_Department.html,Sincelejo,3.5/5,32,Precio Desconocido,"La plaza fue sitio de las corralejas de toros durante varios años y luego se convirtió en un parque deportivo. Finalmente fue renovada y remodelada como plaza de eventos culturales, musicales, folclóricos y oficiales.",24 de enero de 2018,0,0,3.5,negativo
1051,Tripadvisor,74,Covenas Diving Co.,https://www.tripadvisor.co/Attraction_Review-g616329-d13199404-Reviews-or220-Covenas_Diving_Co-Covenas_Sucre_Department.html,Coveñas,5.0/5,259,Precio Desconocido,"Una experiencia inolvidable. Un excelente servicio, personal capacitado y muy profesional, recomendado 100%. Una experiencia diferente para realizar en el puerto de Coveñas.",25 de noviembre de 2019,1,0,5,neutral
985,Tripadvisor,74,Covenas Diving Co.,https://www.tripadvisor.co/Attraction_Review-g616329-d13199404-Reviews-or220-Covenas_Diving_Co-Covenas_Sucre_Department.html,Coveñas,5.0/5,259,Precio Desconocido,"Instructores de buceo ideales, muy buen servicio, equipos y los sitios de buceo espectaculares! Con seguridad volveremos! Great diving instructors, amazing service, gear and diving sites. Will definitely come back! Gracias!!!",7 de febrero de 2021,0,0,5,neutral
822,Tripadvisor,59,Catedral de San Francisco,https://www.tripadvisor.co/Attraction_Review-g1395140-d6960179-Reviews-or20-Catedral_de_San_Francisco-Sincelejo_Sucre_Department.html,Sincelejo,4.0/5,30,Precio Desconocido,"No es más que un sitio representativo, es una linda escultura ubicada en una zona céntrica de la ciudad.",3 de noviembre de 2015,0,0,4,neutral
764,Tripadvisor,57,Archipiélago De San Bernardo,https://www.tripadvisor.co/Attraction_Review-g616329-d14930714-Reviews-or20-Archipelago_Of_San_Bernardo-Covenas_Sucre_Department.html,Coveñas,4.0/5,29,Precio Desconocido,"Excelente el tour a las islas. Nos quedamos en Isla del Rosario de San Bernardo. El almuerzo incluido en el tour es normalito. Las playas son hermosas, muchos peces, una piscina natural, segura para los niños, arena blanca, aguas cristalinas. El viaje de regreso a Tolú es adrenalina pura. Recomendado.",11 de marzo de 2019,1,0,4,neutral
379,Tripadvisor,50,Isla Múcura,https://www.tripadvisor.co/Attraction_Review-g4452849-d2536595-Reviews-or20-Isla_Mucura-San_Onofre_Sucre_Department.html, San Onofre,4.5/5,281,Precio Desconocido,"Una Isla Hermosa..!! Pero es bueno aclarar.. Cuando uno está en Tolu o Coveñas, y decide hacer este tour por las islas del archipiélago de San Bernardo, debe tener claro primero el costo, está en 60 y 80 mil pesos, eso depende si es festivo, o puente, o temporada alta. Segundo, se puede llegar a estar el día en 2 islas, Tintipan o Mucura, Mucura la zona de baño y estadía es más pequeña que Tintipan pero es hermosa, camino a cualquier a de las islas se pasa por Santa Cruz del Islote, el mar es verde esmeralda y muy cristalino en algunos tramos se ve el fondo del mar fácilmente. Tercero si se decide ir a Mucura debe tener presente que no llega al Hotel Punta Faro, no pasa ni cerca y no puede pasar fácilmente allá, el pasadía no es en el hotel. El pasadía es en una playa hermosa que hay cerca a hostales y otro tipo de hospedajes, donde brindan el almuerzo, hay buen sitio de descanso, brisa, mar. Cuarto, la playa es pandita, unos 4 metros o más dentro de la playa es panda se puede caminar fácilmente. Quinto tenga cuidado con todo lo que toma, preferiblemente tome en vaso ya que muchas botellas, de cerveza, gaseosa, y demás que usen tapa metálica por el calor y porque la mantienen en una nevera con agua se intenta oxidar... Sexto, No recomiendo en Tolu la empresa Club náutico Corales, no la recomiendo. El paisaje, la atención, la arena la brisa, todo lo hacen un excelente destino, solo tenga presente esas recomendaciones.",28 de agosto de 2017,0,0,4.5,neutral
373,Tripadvisor,50,Isla Múcura,https://www.tripadvisor.co/Attraction_Review-g4452849-d2536595-Reviews-or20-Isla_Mucura-San_Onofre_Sucre_Department.html, San Onofre,4.5/5,281,Precio Desconocido,"Es un lugar fantástico y con una energía relajante y enriquecedora en el sentido de que hay mucha paz y te puedes encontrar contigo mismo, las instalaciones muy buenas el hostal isla mucura es el mejor, me quede en las hamacas y fue una experiencia muy buena, no tuve ningún inconveniente el alojamiento ya que una noche llovió torrencialmente y no se me mojo nada, la playa y el mar deliciosos la comida ni hablar, te puedes hospedar en cualquier lugar sea costoso o barato la isla es la misma y la comodidad depende de cada uno, solo ten presente que es el ""FIN DEL AFÁN""",9 de noviembre de 2017,0,0,4.5,neutral
184,Foursquare,26,Parrilla Bar,https://es.foursquare.com/v/parrilla-bar/4f47c59ee4b08f45dc069cbd,Sincelejo,7.6/10,15 valoraciones,$$$$,El cucharrasco y elmote de quesoestupendos.,"Julio 27, 2014",0,0,7.6,positivo
405,Tripadvisor,50,Isla Múcura,https://www.tripadvisor.co/Attraction_Review-g4452849-d2536595-Reviews-or20-Isla_Mucura-San_Onofre_Sucre_Department.html, San Onofre,4.5/5,281,Precio Desconocido,"QUIERO VOLVER, VOLVER, VOLVER..... Realmente hermosa, vale la pena visitar. Partimos desde el muelle de Tolú, un trayecto de 40 minutos. Esta isla es espectacular, tiene una arena blanca muy fina, sus aguas van de un tono verde claro, cristalino a diferentes gamas de azul, un paisaje de ensueño. Puedes adentrarte muchos metros, y aun el agua esta en la cintura, aguas tranquilas, cero olas, es tan claro que puedes ver pececillos y estrellas de mar! Pide una piña colada y olvídate del mundo! Almuerzo delicioso y a buen precio. Quiero volver, volver.....",13 de agosto de 2016,1,0,4.5,neutral
933,Tripadvisor,74,Covenas Diving Co.,https://www.tripadvisor.co/Attraction_Review-g616329-d13199404-Reviews-or220-Covenas_Diving_Co-Covenas_Sucre_Department.html,Coveñas,5.0/5,259,Precio Desconocido,Sin duda son unos profesionales en el área del buceo recreativo con gran don de enseñar y con el equipo adecuado para realizar tus buceos con total seguridad mil gracias por su dedicación.,13 de diciembre de 2023,8,0,5,neutral
190,Foursquare,28,La Tagliatella,https://es.foursquare.com/v/la-tagliatella/4c39141bae2da59360f501c6,Sincelejo,7.5/10,9 valoraciones,$$,Muy rico! Me encanto!,"Febrero 11, 2013",0,0,7.5,positivo
909,Tripadvisor,71,Litio Karts,https://www.tripadvisor.co/Attraction_Review-g1395140-d24974016-Reviews-Litio_Karts-Sincelejo_Sucre_Department.html,Sincelejo,5.0/5,3,Precio Desconocido,"Es una experiencia muy divertida, en el lugar no solo hay karts, también hay muro de escalar, paintball, polígono de tiro, jaula de bateo y football en burbujas. Los karts son eléctricos y seguros, la pista es un reto, me costó tomarle el tiro.",12 de febrero de 2023,1,0,5,neutral
584,Tripadvisor,52,Ciénaga la Caimanera,https://www.tripadvisor.co/Attraction_Review-g616329-d10022459-Reviews-Cienaga_la_Caimanera-Covenas_Sucre_Department.html,Coveñas,4.5/5,86,Precio Desconocido,Paseo ecológico pero poco organizado. Manglar talado por la gente de la zona que lo pretende vender como protegido.,31 de diciembre de 2019,2,0,4.5,neutral
547,Tripadvisor,50,Isla Múcura,https://www.tripadvisor.co/Attraction_Review-g4452849-d2536595-Reviews-or20-Isla_Mucura-San_Onofre_Sucre_Department.html, San Onofre,4.5/5,281,Precio Desconocido,"P a R A D I S E mejor lugar en el que he estado en mis 13 años. El servicio era genial, aunque no había suficientes personas para trabajar el lugar. El agua era pescado cristalinas. hermosas nadar en el agua con usted en la playa y es tan relajante. Sin duda el masaje tanto como sea posible, es barato, y te sientes genial, y el sonido de las olas rompiendo debajo de ti, la vista del agua azul es genial. Llevar sudaderas, la isla hace mucho viento por la noche a partir de como cuatro y empeorando. pero no tengo muchas quejas. simplemente hermoso y relajante.",26 de junio de 2014,0,0,4.5,neutral
344,Tripadvisor,50,Isla Múcura,https://www.tripadvisor.co/Attraction_Review-g4452849-d2536595-Reviews-or20-Isla_Mucura-San_Onofre_Sucre_Department.html, San Onofre,4.5/5,281,Precio Desconocido,"Una de los archipielas de San bernardo, es un hermosura volvería 17000 mil veces a este lugar, es lindo, relajante y con muy buena comida, se llega por tour desde Rincón del Mar-Sucre por 50 mil cop (ida y venida) desde aquí se demora 20 minutos desde Cartagena son alrededor de las 2 hrs de viaje en lancha. A todos los Q deseen relajarse deben ir a esta isla.",22 de abril de 2019,2,0,4.5,neutral
65,Foursquare,2,Playas de Coveñas,https://es.foursquare.com/v/playas-de-cove%C3%B1as/4e0b5bd352b1fe83d54c6f4b,Coveñas,8.8/10,241 valoraciones,Precio Desconocido,Para unas buenaas vacaciones estaplayaenamora,"Julio 11, 2013",0,0,8.8,positivo
323,Tripadvisor,50,Isla Múcura,https://www.tripadvisor.co/Attraction_Review-g4452849-d2536595-Reviews-or20-Isla_Mucura-San_Onofre_Sucre_Department.html, San Onofre,4.5/5,281,Precio Desconocido,"Es un lugar con encanto, las playas con su arena blanca y su mar azul son fabulosas, la playa del cholo es perfecta para ir con niños pequeños pues sus aguas son tranquilas y tiene gran espacio bajo para q se puedan bañar.",26 de enero de 2019,0,0,4.5,neutral
192,Foursquare,28,La Tagliatella,https://es.foursquare.com/v/la-tagliatella/4c39141bae2da59360f501c6,Sincelejo,7.5/10,9 valoraciones,$$,"Homangiatoinsalatadimanzoed era deliziosa(apparteil fintoparmigiano). Bella presentazione, ricca di sapori eprodotti freschi.","Enero 27, 2014",0,0,7.5,positivo
1103,Tripadvisor,74,Covenas Diving Co.,https://www.tripadvisor.co/Attraction_Review-g616329-d13199404-Reviews-or220-Covenas_Diving_Co-Covenas_Sucre_Department.html,Coveñas,5.0/5,259,Precio Desconocido,"Guillermo fue absolutamente comprensivo, colaborador, paciente, nos informó con amplitud, claridad, profesionalismo. Yo tenía miedo y casi podría decir que literalmente me llevó de la mano y me acompañó pacientemente durante todo el proceso. Excelentes equipos, en las mejores condiciones. Fue un plan de todo el día, 2 inmersiones, los lugares de inmersión muy lindos. Bastante coral, de buen color y gran variedad de peces, gracias a su experiencia, excelentemente seleccionados. Me encantó. Lo recomiendo.",17 de febrero de 2019,1,0,5,neutral
5,Foursquare,1,Rincón del Mar,https://es.foursquare.com/v/rinc%C3%B3n-del-mar/4f81a185e4b0ac16a2d8f323,San Onofre,8.9/10,45 valoraciones,Precio Desconocido,"Muy buenasplayas, sin olas, sin tantagentecomoPlayaBlanca y con masespaciopara ubicarse. Además todo masbarato....","Enero 6, 2014",0,0,8.9,positivo
486,Tripadvisor,50,Isla Múcura,https://www.tripadvisor.co/Attraction_Review-g4452849-d2536595-Reviews-or20-Isla_Mucura-San_Onofre_Sucre_Department.html, San Onofre,4.5/5,281,Precio Desconocido,"Paraíso A mí la playa de Cartagena no me gustó. La opción es cruzar a Isla Barú con un ferry. La playa allá se llama playa blanca y es un sueño… eso sí! Es lost! No hay servicios así que hay que ir mentalizado. Tienes para alquilar y dormir en hamaca, en cabaña o en carpa por la tuya (gratis), y algún barcito. Sino hay una excursión para ir a pasar el día que sale desde el puerto.",7 de julio de 2014,0,0,4.5,neutral
348,Tripadvisor,50,Isla Múcura,https://www.tripadvisor.co/Attraction_Review-g4452849-d2536595-Reviews-or20-Isla_Mucura-San_Onofre_Sucre_Department.html, San Onofre,4.5/5,281,Precio Desconocido,"Tienes que ir a este tour si te encuentras por Coveñas, Tolú o Rncón del mar. Las aguas son cristalinas y de color turquesa así que empaca tu snorkel y careta y vete sin pensarlo!!!",11 de enero de 2019,2,0,4.5,neutral
667,Tripadvisor,53,Playas Rincon del Mar,https://www.tripadvisor.co/Attraction_Review-g4452849-d10213520-Reviews-or40-Playas_Rincon_del_Mar-San_Onofre_Sucre_Department.html,San Onofre,4.0/5,51,Precio Desconocido,"Para los que nos gusta el mar no hay más nada que pedir: Playas de arena blanca, excelentes restaurantes de comida típica e internacional, paseos en lancha a las islas cercanas, aguas de esplendorosa variedad de tonos desde el azul al verde, aire puro, brisa para guindar hamacas. Qué delicia.",18 de febrero de 2020,0,0,4,neutral
182,Foursquare,26,Parrilla Bar,https://es.foursquare.com/v/parrilla-bar/4f47c59ee4b08f45dc069cbd,Sincelejo,7.6/10,15 valoraciones,$$$$,"Muy buena la comida y la atención, un sitio para pasar un rato muy agradable, buena comida un buen trago y una buena compañía, varios ambientes y bien parqueo,  bien muy buenos.","Febrero 8, 2014",2,0,7.6,positivo
19,Foursquare,1,Rincón del Mar,https://es.foursquare.com/v/rinc%C3%B3n-del-mar/4f81a185e4b0ac16a2d8f323,San Onofre,8.9/10,45 valoraciones,Precio Desconocido,Hermosasplayasy sicomida frescalo mejor :),"Marzo 8, 2013",0,0,8.9,positivo
1295,Tripadvisor,81,Sunset Travel Colombia,https://www.tripadvisor.co/Attraction_Review-g1395140-d21293956-Reviews-Sunset_Travel_Colombia-Sincelejo_Sucre_Department.html,Sincelejo,5.0/5,5,Precio Desconocido,"Excelente los destinos y la atención, la cámara no es suficiente para capturar los momentos y paisajes que experimentas por ti mismo. Llevar mucho bloqueador.",19 de septiembre de 2020,0,0,5,neutral
531,Tripadvisor,50,Isla Múcura,https://www.tripadvisor.co/Attraction_Review-g4452849-d2536595-Reviews-or20-Isla_Mucura-San_Onofre_Sucre_Department.html, San Onofre,4.5/5,281,Precio Desconocido,"ONU - Nulas el paraíso Hicimos un viaje de un día aquí de cerca de Punta Seca con mi novia y mi mejor amigo y su familia. Nuestro barco alquilado nos recogió a las 8:30 de la mañana y regresar a nuestra casa en la playa a las 2 pm. El mar se pone revuelto alrededor de ese tiempo, y usted debe planear su día en consecuencia. Nuestro tour - Guía de Marcel (pregunta a los nativos para él en Rincón del Marzo) nos llevó a comer en Múcura después de visitar Santa Cruz del Islote, el mundo de la isla más densamente poblada. Nos hicimos fotos con tortugas, nadamos con tiburones de enfermera en el acuario, y minúscula compramos cerveza y recuerdos de la gente. Mejor de lo español básico es necesario para viajar a la región, y la mayoría de los lugares están sólo en efectivo.",11 de abril de 2017,0,0,4.5,neutral
1144,Tripadvisor,75,Rincón Dive Center,https://www.tripadvisor.co/Attraction_Review-g10326747-d14126059-Reviews-or60-Rincon_Dive_Center-Rincon_del_Mar_San_Onofre_Sucre_Department.html,San Onofre,5.0/5,192,Precio Desconocido,Un personal muy querido y a su vez bien preparado. Te cuenta muy detalladamente sobre los sitios de buceo.,6 de septiembre de 2022,0,0,5,neutral
1136,Tripadvisor,74,Covenas Diving Co.,https://www.tripadvisor.co/Attraction_Review-g616329-d13199404-Reviews-or220-Covenas_Diving_Co-Covenas_Sucre_Department.html,Coveñas,5.0/5,259,Precio Desconocido,"En manos del Mejor Instructor Guillermo Camara, excelente enseñanza, excelentes equipos y toda la logística y paciencia para que aprendamos a vivir nuevas aventuras bajo el mar!",4 de diciembre de 2017,0,0,5,neutral
1072,Tripadvisor,74,Covenas Diving Co.,https://www.tripadvisor.co/Attraction_Review-g616329-d13199404-Reviews-or220-Covenas_Diving_Co-Covenas_Sucre_Department.html,Coveñas,5.0/5,259,Precio Desconocido,"La mejor opción para hacer algo diferente en Coveñas. Centro de Buceo muy bien equipado y Guillermo, el instructor, es un gran profesor, muy profesional y experimentado. Definitivamente volveré a repetir esos hermosos buceos en las islas de San Bernardo, aguas claras y con la temperatura ideal.",9 de septiembre de 2019,0,0,5,neutral
495,Tripadvisor,50,Isla Múcura,https://www.tripadvisor.co/Attraction_Review-g4452849-d2536595-Reviews-or20-Isla_Mucura-San_Onofre_Sucre_Department.html, San Onofre,4.5/5,281,Precio Desconocido,"Un remanso de tranquilidad Nos encantó el servicio, la playa, la habitación cómoda y amplia, el paisaje insuperable. Es un lugar de descanso, no de bulla, solo el cantar de las aves y el sonido del mar. Recomendable llevarse un buen libro, ya que las entretenciones son solo acuáticas: buceo, playa, snorkel, etc. Las cenas se hacen en distintos lugares del parque donde lo iluminan y se ve precioso y muy romántico, las comidas son en base a pescados y mariscos.",6 de marzo de 2014,0,0,4.5,neutral
60,Foursquare,2,Playas de Coveñas,https://es.foursquare.com/v/playas-de-cove%C3%B1as/4e0b5bd352b1fe83d54c6f4b,Coveñas,8.8/10,241 valoraciones,Precio Desconocido,El mejor sitio para compartir en flia,"Enero 26, 2014",0,0,8.8,positivo
927,Tripadvisor,74,Covenas Diving Co.,https://www.tripadvisor.co/Attraction_Review-g616329-d13199404-Reviews-or220-Covenas_Diving_Co-Covenas_Sucre_Department.html,Coveñas,5.0/5,259,Precio Desconocido,"Una experiencia sencillamente fantástica, el personal fue muy profesional y la actividad muy segura y divertida.",7 de diciembre de 2023,2,0,5,neutral
1035,Tripadvisor,74,Covenas Diving Co.,https://www.tripadvisor.co/Attraction_Review-g616329-d13199404-Reviews-or220-Covenas_Diving_Co-Covenas_Sucre_Department.html,Coveñas,5.0/5,259,Precio Desconocido,"Excelente instrucción, muy seguro, recomendado para quienes comienzan en el mundo de la exploración en el mar. Para todos en la familia.",6 de enero de 2020,1,0,5,neutral
