ID,Sitio,Índice del lugar,Nombre del lugar,Enlace del lugar,Municipio,Valoración,Valoraciones,Precio,Comentario,Fecha,Votos a favor,Votos en contra,Valoración_num,Sentimiento
1293,Tripadvisor,80,Rincón del mar Diving,https://www.tripadvisor.co/Attraction_Review-g10326747-d17274098-Reviews-or10-Rincon_del_mar_Diving-Rincon_del_Mar_San_Onofre_Sucre_Department.html,San Onofre,5.0/5,30,Precio Desconocido,"Hice mi certificación CMAS de aguas abiertas y también mi baptem de buceo en el centro Buceo de Rincón del March y la pasé muy bien con Julie y Alberto. Son grandes instructores, serios y confiables. Son personas divertidas y agradables también. Se las arreglan para enseñarnos a bucear en inglés, español e incluso francés si es necesario. ¡Los arrecifes de coral también son excepcionales! Recomiendo mucho este centro de buceo. ¡Gracias de nuevo por la increíble experiencia! :)",31 de agosto de 2019,0,0,5,neutral
314,Foursquare,49,Hamburguesas El Corral,https://foursquare.com/v/hamburguesas-el-corral/4cd5d394886cb60c247a8689,Sincelejo,6.4/10,21 valoraciones,$,"La mejor hamburguesa: la especial. Las papas a la francesa con salsa bbq una locura!! Eso sí, el gustico cuando se pueda porque es costoso!","Julio 13, 2015",0,0,6.4,neutral
1119,Tripadvisor,74,Covenas Diving Co.,https://www.tripadvisor.co/Attraction_Review-g616329-d13199404-Reviews-or220-Covenas_Diving_Co-Covenas_Sucre_Department.html,Coveñas,5.0/5,259,Precio Desconocido,"Excelente centro de buceo y excelente personal que combina perfectamente, la profesionalidad, basada en años de experiencia, con el trato familiar.",11 de junio de 2018,0,0,5,neutral
73,Foursquare,2,Playas de Coveñas,https://es.foursquare.com/v/playas-de-cove%C3%B1as/4e0b5bd352b1fe83d54c6f4b,Coveñas,8.8/10,241 valoraciones,Precio Desconocido,En este momento elmarestaaaa peligrosooooooooo,"Octubre 17, 2011",0,0,8.8,positivo
248,Foursquare,40,Waroka Parrilla Bar,https://foursquare.com/v/waroka-parrilla-bar/4e9639e277c83a33155f509f,Sincelejo,7.0/10,15 valoraciones,$$$$,"Muy buena comida, la verdad","Agosto 21, 2013",0,0,7,positivo
1049,Tripadvisor,74,Covenas Diving Co.,https://www.tripadvisor.co/Attraction_Review-g616329-d13199404-Reviews-or220-Covenas_Diving_Co-Covenas_Sucre_Department.html,Coveñas,5.0/5,259,Precio Desconocido,"Bucear por primera vez fue una gran experiencia gracias a Coveñas Diving por esta gran oportunidad, muy profesionales.",26 de noviembre de 2019,0,0,5,neutral
1142,Tripadvisor,75,Rincón Dive Center,https://www.tripadvisor.co/Attraction_Review-g10326747-d14126059-Reviews-or60-Rincon_Dive_Center-Rincon_del_Mar_San_Onofre_Sucre_Department.html,San Onofre,5.0/5,192,Precio Desconocido,Bucear con Stefania fue una experiencia increíble. Les recomiendo al 100% Rincón Dive Center porque los instructores toman el tiempo para explicarles y traen mucha confianza.,22 de octubre de 2022,1,0,5,neutral
7,Foursquare,1,Rincón del Mar,https://es.foursquare.com/v/rinc%C3%B3n-del-mar/4f81a185e4b0ac16a2d8f323,San Onofre,8.9/10,45 valoraciones,Precio Desconocido,Camarones al ajillodonde LaNegrita... sabor del bueno. Un rincón alejado de mucho y con todas las bondades pararelajarse,"Enero 10, 2014",0,0,8.9,positivo
490,Tripadvisor,50,Isla Múcura,https://www.tripadvisor.co/Attraction_Review-g4452849-d2536595-Reviews-or20-Isla_Mucura-San_Onofre_Sucre_Department.html, San Onofre,4.5/5,281,Precio Desconocido,"Un paraíso en el Caribe Colombiano!!!!! Bella tierra de islas hermosas y aguas cristalinas, un paisaje espectacular, un mar de aguas cálidas al cual se puede ir desde Cartagena de Indias o desde la ciudad de Tolú (45 minutos en lancha). Un paseo maravilloso, para toda la familia, a un sitio tranquilo, relajado y un regalo para los sentidos.",6 de mayo de 2014,0,0,4.5,neutral
529,Tripadvisor,50,Isla Múcura,https://www.tripadvisor.co/Attraction_Review-g4452849-d2536595-Reviews-or20-Isla_Mucura-San_Onofre_Sucre_Department.html, San Onofre,4.5/5,281,Precio Desconocido,Las más bella de todas Quien quiera más que le piquen caña... simplemente BELLA,2 de abril de 2012,0,0,4.5,neutral
347,Tripadvisor,50,Isla Múcura,https://www.tripadvisor.co/Attraction_Review-g4452849-d2536595-Reviews-or20-Isla_Mucura-San_Onofre_Sucre_Department.html, San Onofre,4.5/5,281,Precio Desconocido,"Es un lugar con encanto, las playas con su arena blanca y su mar azul son fabulosas, la playa del cholo es perfecta para ir con niños pequeños pues sus aguas son tranquilas y tiene gran espacio bajo para q se puedan bañar.",26 de enero de 2019,1,0,4.5,neutral
1131,Tripadvisor,74,Covenas Diving Co.,https://www.tripadvisor.co/Attraction_Review-g616329-d13199404-Reviews-or220-Covenas_Diving_Co-Covenas_Sucre_Department.html,Coveñas,5.0/5,259,Precio Desconocido,"Es una excelente opción para practicar y aprender buceo. Guillermo el instructor es muy bueno explicando, muy profesional y paciente. Totalmente recomendado. Muy buena experiencia",31 de diciembre de 2017,0,0,5,neutral
240,Foursquare,39,Piccola Italia Pizzas,https://foursquare.com/v/piccola-italia-pizzas/5220da7f11d281a9bfa32484,Sincelejo,7.2/10,14 valoraciones,$$,"Is great, is not fast foot definitely, is a better choice if you have time","Enero 6, 2016",0,0,7.2,positivo
10,Foursquare,1,Rincón del Mar,https://es.foursquare.com/v/rinc%C3%B3n-del-mar/4f81a185e4b0ac16a2d8f323,San Onofre,8.9/10,45 valoraciones,Precio Desconocido,Camarones al ajillodonde LaNegrita... sabor del bueno con sonido real... alpiede latranquilidaddelmar,"Enero 10, 2014",0,0,8.9,positivo
1207,Tripadvisor,77,Guía de Turismo del Golfo de Morrosquillo,https://www.tripadvisor.co/Attraction_Review-g616329-d12951539-Reviews-or30-Covenas_Colombia_Travel-Covenas_Sucre_Department.html,Coveñas,5.0/5,30,Precio Desconocido,"Es una persona llena de carisma, gentileza, inteligencia y amor por su trabajo! Hizo nuestra visita algo increíble y enriquecedor, recomendado al 200%",25 de diciembre de 2018,1,0,5,neutral
1271,Tripadvisor,79,Anfibio Sports Adventure,https://www.tripadvisor.co/Attraction_Review-g10326747-d23061629-Reviews-or30-Anfibio_Sports_Adventure-Rincon_del_Mar_San_Onofre_Sucre_Department.html,San Onofre,5.0/5,34,Precio Desconocido,"Vencí uno de mis mayores temores gracias a Anfibio Sports Adventure. Fue una experiencia única e inolvidable gracias al profesionalismo y compañía de Ciro, pues estuvo pendiente de cada detalle desde el día anterior a la actividad hasta que finalizó. El día empieza con un café delicioso y una corta conversación, para luego prepararnos y ver el maravilloso amanecer en Rincón del Mar mientras realizamos el recorrido en el Stand up Paddle. Definitivamente volveremos, pues nos faltó hacer el recorrido Mountain Bike, con seguridad seguiremos contactando a Ciro y Anfibio Sports Adventure para seguir explorando y conociendo este lugar maravilloso",1 de febrero de 2021,0,0,5,neutral
141,Foursquare,20,Zona S,https://es.foursquare.com/v/zona-s/536fd735498eaf1e39ad1a91,Sincelejo,7.8/10,12 valoraciones,Precio Desconocido,Muy buena comida. Rápida y amable atención 👏🏻👏🏻👏🏻,"Abril 23, 2016",0,0,7.8,positivo
528,Tripadvisor,50,Isla Múcura,https://www.tripadvisor.co/Attraction_Review-g4452849-d2536595-Reviews-or20-Isla_Mucura-San_Onofre_Sucre_Department.html, San Onofre,4.5/5,281,Precio Desconocido,"Isla Buenas islas Sucreñas, como si fuera escoltada por un grupo de islas estrellas",9 de abril de 2012,0,0,4.5,neutral
469,Tripadvisor,50,Isla Múcura,https://www.tripadvisor.co/Attraction_Review-g4452849-d2536595-Reviews-or20-Isla_Mucura-San_Onofre_Sucre_Department.html, San Onofre,4.5/5,281,Precio Desconocido,"Playa Vacia Es una maravilla en baja temporada, la playa es prácticamente para uno solo, sin tumultos, ni aglomeraciones. La comida es espectacular ya que todo es fresco y recién pescado.",28 de octubre de 2014,0,0,4.5,neutral
494,Tripadvisor,50,Isla Múcura,https://www.tripadvisor.co/Attraction_Review-g4452849-d2536595-Reviews-or20-Isla_Mucura-San_Onofre_Sucre_Department.html, San Onofre,4.5/5,281,Precio Desconocido,"Recomiendo Hotel Punta Faro Hotel de ensueño, donde se respira paz, silencio y aprenderás a estar contigo mismo. Si viajas en pareja, no lo pienses.",13 de marzo de 2014,0,0,4.5,neutral
832,Tripadvisor,60,Teatro Municipal de Sincelejo,https://www.tripadvisor.co/Attraction_Review-g1395140-d7745942-Reviews-or10-Teatro_Municipal_de_Sincelejo-Sincelejo_Sucre_Department.html,Sincelejo,4.0/5,11,Precio Desconocido,"Falta mantenimiento, limpieza, y un mejor aprovechamiento del espacio interno. Funciona una sede de la alcaldía municipal también.",13 de noviembre de 2017,0,0,4,neutral
802,Tripadvisor,59,Catedral de San Francisco,https://www.tripadvisor.co/Attraction_Review-g1395140-d6960179-Reviews-or20-Catedral_de_San_Francisco-Sincelejo_Sucre_Department.html,Sincelejo,4.0/5,30,Precio Desconocido,"Muy grande y bonita en medio de una plaza grande muy amena y concurrida. Su arquitectura, aunque sencilla, se impone en medio de esta plaza. Mientras estábamos de paso no la encontramos abierta. La conocimos cuando íbamos de camino a Cartagena y aprovechamos para recorrer un poco la ciudad, que resultó ser muy congestionada y bastante calurosa.",26 de julio de 2019,0,0,4,neutral
549,Tripadvisor,51,Reserva Natural Sanguaré,, San Onofre,5.0/5,35,Precio Desconocido,"Excelente lugar, paisajes hermosos, experiencias alucinantes, atención sin igual, alimentación insuperable e intimidad hacen de la Reserva Natural Sanguaré el sitio ideal para descansar, aventurarse y desconectarse en medio de una naturaleza exhuberante y playas hermosas. Los atardeceres cargados de colores en un mar tranquilo como una piscina. Se puede caretear, ver plancton bioluminiscente, andar en kayak, hacer caminatas, ver las estrellas y relajarse. Y la calidad humana de quienes laboran allí es fantástica. Gastronómicamente hablando la calidad y variedad es encomiable, el menú vegetariano estuvo perfecto.",15 de diciembre de 2020,1,0,5,neutral
134,Foursquare,14,Hotel La Fragata,https://es.foursquare.com/v/hotel-la-fragata/4c9e2bd58afca0931a04fe15,Coveñas,7.9/10,26 valoraciones,Precio Desconocido,Excelentebaren lapiscinay el mejor ambiente. Muy buenhotel,"Septiembre 10, 2015",1,0,7.9,positivo
321,Foursquare,49,Hamburguesas El Corral,https://foursquare.com/v/hamburguesas-el-corral/4cd5d394886cb60c247a8689,Sincelejo,6.4/10,21 valoraciones,$,Sabes q si…,"Diciembre 28, 2011",0,0,6.4,neutral
1182,Tripadvisor,75,Rincón Dive Center,https://www.tripadvisor.co/Attraction_Review-g10326747-d14126059-Reviews-or60-Rincon_Dive_Center-Rincon_del_Mar_San_Onofre_Sucre_Department.html,San Onofre,5.0/5,192,Precio Desconocido,"No tengo más que agradecimiento, felicidad y excelentes recomendaciones para todos aquellos que quieran experimentar el mundo del buceo. Stephania y Giovanni son geniales, super profesionales, con mucha buena onda y super atentos. Tienen un centro de Dive hermoso, con el equipamiento en excelentes condiciones y son super recomendables para iniciar en Open Water, Advance o hacer Fun Dices por lugares alucinantes. Te hacen sentir en familia en todo momento. Los recomiendo 100%",14 de abril de 2019,2,0,5,neutral
1009,Tripadvisor,74,Covenas Diving Co.,https://www.tripadvisor.co/Attraction_Review-g616329-d13199404-Reviews-or220-Covenas_Diving_Co-Covenas_Sucre_Department.html,Coveñas,5.0/5,259,Precio Desconocido,"Excelente servicio de mini curso de buceo e inmersión, puedes certificarte PADI, con ellos y todo en el corazón de Coveñas, tienen planes para las islas, súper la experiencia 2 veces me ha ido súper bien",10 de octubre de 2020,0,0,5,neutral
740,Tripadvisor,56,Playa la Coquerita,https://www.tripadvisor.co/Attraction_Review-g616329-d10465002-Reviews-or20-Playa_la_Coquerita-Covenas_Sucre_Department.html,Coveñas,4.0/5,28,Precio Desconocido,"Una de las mejores playas que he visitado, tanto de día como de noche, muy limpia y tranquila. Sin duda alguna, ¡100% recomendada!",26 de octubre de 2016,0,0,4,neutral
552,Tripadvisor,51,Reserva Natural Sanguaré,https://www.tripadvisor.co/Attraction_Review-g4452849-d7149029-Reviews-Reserva_Natural_Sanguare-San_Onofre_Sucre_Department.html, San Onofre,5.0/5,35,Precio Desconocido,"El sitio mas relajante que puedas visitar con la comida más rica del mundo. TODOS los que te atienden son excelentes personas. Espero no demorarme en volver a visitarlos, los amamos.",5 de enero de 2018,0,0,5,neutral
737,Tripadvisor,56,Playa la Coquerita,https://www.tripadvisor.co/Attraction_Review-g616329-d10465002-Reviews-or20-Playa_la_Coquerita-Covenas_Sucre_Department.html,Coveñas,4.0/5,28,Precio Desconocido,"Bonita, muy bien organizada, lástima algunos vendedores pero la arena es muy buena, muy cerca de todo.",22 de diciembre de 2016,0,0,4,neutral
1262,Tripadvisor,79,Anfibio Sports Adventure,https://www.tripadvisor.co/Attraction_Review-g10326747-d23061629-Reviews-or30-Anfibio_Sports_Adventure-Rincon_del_Mar_San_Onofre_Sucre_Department.html,San Onofre,5.0/5,34,Precio Desconocido,"El recorrido en bici fue maravilloso, el terreno es suave, los paisajes muy bonitos, Ciro es muy atento, súper recomendada la estación en Casa Surya. Quedamos enamorados de Rincón del Mar.",28 de marzo de 2021,0,0,5,neutral
1090,Tripadvisor,74,Covenas Diving Co.,https://www.tripadvisor.co/Attraction_Review-g616329-d13199404-Reviews-or220-Covenas_Diving_Co-Covenas_Sucre_Department.html,Coveñas,5.0/5,259,Precio Desconocido,Mantener el equilibrio en un ambiente diferente y conocer un poquito del planeta desde otra perspectiva hace del buceo la actividad perfecta en cualquier temporada del año.,13 de mayo de 2019,0,0,5,neutral
4,Foursquare,1,Rincón del Mar,https://es.foursquare.com/v/rinc%C3%B3n-del-mar/4f81a185e4b0ac16a2d8f323,San Onofre,8.9/10,45 valoraciones,Precio Desconocido,Bucear desde lacabañade Juan.  Ir a Titipan a pasar la tarde y tomar uncóctel,"Enero 2, 2016",1,0,8.9,positivo
100,Foursquare,6,Sincé - Sucre,https://es.foursquare.com/v/sinc%C3%A9--sucre/4e247cc0e4cdf68591a3811c,Sincé,8.2/10,16 valoraciones,Precio Desconocido,Pregunta por labolita de leche!,"Octubre 17, 2011",0,0,8.2,positivo
304,Foursquare,47,Subway,https://foursquare.com/v/subway/51cf97eb498e45e353469d92,Sincelejo,6.7/10,13 valoraciones,$,Jamás me aburre.,"Noviembre 6, 2013",0,0,6.7,neutral
993,Tripadvisor,74,Covenas Diving Co.,https://www.tripadvisor.co/Attraction_Review-g616329-d13199404-Reviews-or220-Covenas_Diving_Co-Covenas_Sucre_Department.html,Coveñas,5.0/5,259,Precio Desconocido,"Mi parte favorita fue cuando buceamos y pudimos ver corales, erizos y peces es algo muy divertido y una experiencia única que vale la pena repetirlo",2 de diciembre de 2020,0,0,5,neutral
481,Tripadvisor,50,Isla Múcura,https://www.tripadvisor.co/Attraction_Review-g4452849-d2536595-Reviews-or20-Isla_Mucura-San_Onofre_Sucre_Department.html, San Onofre,4.5/5,281,Precio Desconocido,"Excelente lugar Un paraíso natural de belleza, único en el mundo, muy bueno para amantes de la naturaleza, espero volver pronto.",19 de agosto de 2014,0,0,4.5,neutral
1264,Tripadvisor,79,Anfibio Sports Adventure,https://www.tripadvisor.co/Attraction_Review-g10326747-d23061629-Reviews-or30-Anfibio_Sports_Adventure-Rincon_del_Mar_San_Onofre_Sucre_Department.html,San Onofre,5.0/5,34,Precio Desconocido,"Súper recomendado la actividad de paddle con Ciro, muy profesional, súper pendiente de todo el grupo, nos dio mucha confianza! Fue increíble el paseo!",9 de marzo de 2021,0,0,5,neutral
763,Tripadvisor,57,Archipiélago De San Bernardo,https://www.tripadvisor.co/Attraction_Review-g616329-d14930714-Reviews-or20-Archipelago_Of_San_Bernardo-Covenas_Sucre_Department.html,Coveñas,4.0/5,29,Precio Desconocido,"El viaje en lancha fue muy bueno. Se pueden apreciar diferentes islas del archipiélago, conocer la isla más poblada del mundo y disfrutar del clima, mar y sus colores espectaculares en Isla Múcura.",9 de mayo de 2019,1,0,4,neutral
755,Tripadvisor,57,Archipiélago De San Bernardo,https://www.tripadvisor.co/Attraction_Review-g616329-d14930714-Reviews-or20-Archipelago_Of_San_Bernardo-Covenas_Sucre_Department.html,Coveñas,4.0/5,29,Precio Desconocido,"La playa para visitar en Mûcura, ya que Tintipán está muy lleno y no hay agua potable para lavado de manos. Muchas moscas, mucho desorden y, a pesar de tener un mar precioso, hay detalles que no dejan disfrutar el paraíso que podría ser. El recorrido en lancha es genial y la empresa de logística es muy cumplida y ágil para el tour. No me gustó Islotes, pero el apoyo económico que nos pidieron para un tour me pareció de noble intención.",11 de agosto de 2021,1,0,4,neutral
1122,Tripadvisor,74,Covenas Diving Co.,https://www.tripadvisor.co/Attraction_Review-g616329-d13199404-Reviews-or220-Covenas_Diving_Co-Covenas_Sucre_Department.html,Coveñas,5.0/5,259,Precio Desconocido,"Muchísimos corales de especies diferentes, mucha visibilidad en el agua, un buceo seguro y precioso. Me encantó que fue una oportunidad de recorrer el archipiélago, un viaje increíble vale la pena.",3 de mayo de 2018,0,0,5,neutral
74,Foursquare,3,Juan Valdez Café,https://es.foursquare.com/v/juan-valdez-caf%C3%A9/5287d40811d248c7e753a537,Sincelejo,8.8/10,30 valoraciones,$,"Aunque elcafey los nevados son buenísimos, mi experiencia con el local de Sincelejo no ha sido la mejor, en una ocasión me sirvieron lo que no era y en otra me salió un pelo en unpastel de pollo.","Enero 15, 2014",0,0,8.8,positivo
726,Tripadvisor,56,Playa la Coquerita,https://www.tripadvisor.co/Attraction_Review-g616329-d10465002-Reviews-or20-Playa_la_Coquerita-Covenas_Sucre_Department.html,Coveñas,4.0/5,28,Precio Desconocido,"La playa es pequeña y dependiendo de la temporada vas a poder encontrar un espacio donde pasar el día. Lo malo es que la playa está muy sucia, se encuentran plásticos, botellas y demás residuos. Tampoco me gustó que en las noches hay pequeños kioscos donde venden licor y ponen música a todo volumen, sin moderación.",10 de enero de 2020,4,0,4,neutral
944,Tripadvisor,74,Covenas Diving Co.,https://www.tripadvisor.co/Attraction_Review-g616329-d13199404-Reviews-or220-Covenas_Diving_Co-Covenas_Sucre_Department.html,Coveñas,5.0/5,259,Precio Desconocido,"Raiana, muchas gracias por elegirnos y por tus comentarios. Esperamos que disfrutes del resto de tu viaje y que vuelvas por Colombia.",1 de enero de 2022,2,0,5,neutral
381,Tripadvisor,50,Isla Múcura,https://www.tripadvisor.co/Attraction_Review-g4452849-d2536595-Reviews-or20-Isla_Mucura-San_Onofre_Sucre_Department.html, San Onofre,4.5/5,281,Precio Desconocido,"Muy congestionada pero valió la pena Es un viaje en lancha como pocos y tuve la oportunidad de caretear o snorkel que llaman, en medio de la inmensidad del mar, una sensación muy extraña y placentera.",6 de agosto de 2017,0,0,4.5,neutral
1239,Tripadvisor,78,Mar de leva tour,https://www.tripadvisor.co/Attraction_Review-g10326747-d25178400-Reviews-Mar_de_leva_tour-Rincon_del_Mar_San_Onofre_Sucre_Department.html,San Onofre,5.0/5,12,Precio Desconocido,El servicio de transporte es muy puntual y cómodo. Guillermo es un excelente conductor. Totalmente recomendado,8 de septiembre de 2023,1,0,5,neutral
1012,Tripadvisor,74,Covenas Diving Co.,https://www.tripadvisor.co/Attraction_Review-g616329-d13199404-Reviews-or220-Covenas_Diving_Co-Covenas_Sucre_Department.html,Coveñas,5.0/5,259,Precio Desconocido,Gracias al instructor Guillermo y su ayudante Juan por una Increíble experiencia de buceo recreativo y su acompañamiento haciendo curso para obtener certificación PADI open water. Cuentan con la capacitación y experiencia requerida para desarrollar esta actividad de la mejor manera. RECOMENDADO 100%,22 de septiembre de 2020,0,0,5,neutral
27,Foursquare,2,Playas de Coveñas,https://es.foursquare.com/v/playas-de-cove%C3%B1as/4e0b5bd352b1fe83d54c6f4b,Coveñas,8.8/10,241 valoraciones,Precio Desconocido,Vale la pena montar enchorizo! Y salir desde temprano a tomar elsol! Elmares delicioso! ALMUERZO a la orilla delmar! Lo máximo!,"Diciembre 31, 2015",1,0,8.8,positivo
493,Tripadvisor,50,Isla Múcura,https://www.tripadvisor.co/Attraction_Review-g4452849-d2536595-Reviews-or20-Isla_Mucura-San_Onofre_Sucre_Department.html, San Onofre,4.5/5,281,Precio Desconocido,Precioso paisaje pero destino caro El paisaje de la isla es hermoso pero existen otros puntos en el Caribe similares. El traslado en lancha de dos horas puede llegar a ser desagradable cuando hay mucho viento y es carísimo! El Hotel Punta Faro ofrece servicios medios a precios de un hotel de lujo.,27 de marzo de 2014,0,0,4.5,neutral
1215,Tripadvisor,77,Guía de Turismo del Golfo de Morrosquillo,https://www.tripadvisor.co/Attraction_Review-g616329-d12951539-Reviews-or30-Covenas_Colombia_Travel-Covenas_Sucre_Department.html,Coveñas,5.0/5,30,Precio Desconocido,"Lorica un lugar hermoso lleno de historia y cultura. Manuel Agresod, un excelente guía, informado, amable y muy entretenido. Desde Lorica visitamos varios pueblos muy interesantes como Colosó y Tuchin, tierra de indígenas Zenúes",4 de julio de 2018,1,0,5,neutral
641,Tripadvisor,52,Ciénaga la Caimanera,https://www.tripadvisor.co/Attraction_Review-g616329-d10022459-Reviews-Cienaga_la_Caimanera-Covenas_Sucre_Department.html,Coveñas,4.5/5,86,Precio Desconocido,"Bello paseo, muy recomendado si te gusta la naturaleza y conocer sobre manglares, flora y fauna del lugar. Es un paseo en canoa por una ciénaga muy cuidada y limpia, el recorrido se hace en hora y media, ponte un sombrero y bloqueador solar. Al llegar a la casa flotante pruebas las ostras y compras concha nácar para la piel. Date un refrescante chapuzón alrededor de la casa flotante, sin miedo, no hay caimanes ya. Es muy lindo, repetiría la experiencia!",12 de agosto de 2016,0,0,4.5,neutral
368,Tripadvisor,50,Isla Múcura,https://www.tripadvisor.co/Attraction_Review-g4452849-d2536595-Reviews-or20-Isla_Mucura-San_Onofre_Sucre_Department.html, San Onofre,4.5/5,281,Precio Desconocido,Un lugar muy bonito y cerca a otros lugares como santa cruz del islote y Tintipan que son de locos. la comida es muy rica en los restaurantes de los lugareños a 20 mil COP (5 dolares),5 de diciembre de 2017,1,0,4.5,neutral
1032,Tripadvisor,74,Covenas Diving Co.,https://www.tripadvisor.co/Attraction_Review-g616329-d13199404-Reviews-or220-Covenas_Diving_Co-Covenas_Sucre_Department.html,Coveñas,5.0/5,259,Precio Desconocido,"Realizamos 2 inmersiones cerca a Tintipan, todo estuvo súper, Guillermo estuvo siempre muy pendiente de todo y presto a colaborarnos, fue hermoso, seguro y algo que realmente hay que vivir.",10 de enero de 2020,0,0,5,neutral
1102,Tripadvisor,74,Covenas Diving Co.,https://www.tripadvisor.co/Attraction_Review-g616329-d13199404-Reviews-or220-Covenas_Diving_Co-Covenas_Sucre_Department.html,Coveñas,5.0/5,259,Precio Desconocido,Excelente opción en el Golfo de Morrosquillo para quien quiera vivir la experiencia de explorar el mundo submarino o quien desee adelantar un curso de certificación de buceo. Recomendado cien por cien,20 de marzo de 2019,0,0,5,neutral
1108,Tripadvisor,74,Covenas Diving Co.,https://www.tripadvisor.co/Attraction_Review-g616329-d13199404-Reviews-or220-Covenas_Diving_Co-Covenas_Sucre_Department.html,Coveñas,5.0/5,259,Precio Desconocido,"Es un excelente plan, con un equipo de personas muy profesionales y súper pendientes de ti, ante todo la seguridad y la tranquilidad de cada uno de los participantes. Guillermo está muy pendiente de cada uno de los detalles y que cada uno tenga una experiencia agradable.",8 de octubre de 2018,1,0,5,neutral
259,Foursquare,41,Philadelphia,https://foursquare.com/v/philadelphia/4e98d45f5c5caa2f44c5ec30,Sincelejo,6.9/10,13 valoraciones,$,Hamburguesa choripollo una bendición jajajjaja,"Agosto 22, 2013",0,0,6.9,neutral
99,Foursquare,6,Sincé - Sucre,https://es.foursquare.com/v/sinc%C3%A9--sucre/4e247cc0e4cdf68591a3811c,Sincé,8.2/10,16 valoraciones,Precio Desconocido,Visiten la mejor discotk que tiene sincé. Q'rrambar,"Enero 2, 2012",0,0,8.2,positivo
854,Tripadvisor,64,Plaza de Majagual,https://www.tripadvisor.co/Attraction_Review-g1395140-d6951865-Reviews-or30-Plaza_de_Majagual-Sincelejo_Sucre_Department.html,Sincelejo,3.5/5,32,Precio Desconocido,Todo se resume en plaza Majagual insegura y le falta iluminación. Olvidada por clase dirigente esa plaza en cuanto a seguridad.,27 de abril de 2018,1,0,3.5,negativo
835,Tripadvisor,60,Teatro Municipal de Sincelejo,https://www.tripadvisor.co/Attraction_Review-g1395140-d7745942-Reviews-or10-Teatro_Municipal_de_Sincelejo-Sincelejo_Sucre_Department.html,Sincelejo,4.0/5,11,Precio Desconocido,"El teatro municipal es fundamental para el desarrollo de Sincelejo, sus instalaciones están bien adecuadas, sillas cómodas. Externamente está algo descuidado, a su alrededor hay invasión del espacio público.",13 de enero de 2016,0,0,4,neutral
984,Tripadvisor,74,Covenas Diving Co.,https://www.tripadvisor.co/Attraction_Review-g616329-d13199404-Reviews-or220-Covenas_Diving_Co-Covenas_Sucre_Department.html,Coveñas,5.0/5,259,Precio Desconocido,Fue una de las mejores experiencias en mi vida!! GUILLO el español me hizo sentir en confianza y dejo que fluyera al ritmo de las olas de verdad que recomendadisimo,16 de febrero de 2021,0,0,5,neutral
898,Tripadvisor,69,Golfo de Morrosquillo,https://www.tripadvisor.co/Attraction_Review-g1726000-d7050550-Reviews-or10-Golfo_de_Morrosquillo-Santiago_de_Tolu_Sucre_Department.html,Santiago de Tolú,4.5/5,15,Precio Desconocido,"Excelente el día de sol, las playas únicas, cristalinas y cálidas, el almuerzo especial pescado o lo que desee, las cocadas que hacen en la isla son deliciosas, lo mismo los cócteles que venden allí.",1 de agosto de 2019,0,0,4.5,neutral
